{
  "record_id": "AKTA-SAR-DEMO0001",
  "record_type": "scientific_action_record",
  "timestamp": "2026-06-01T12:00:00Z",
  "system": {
    "system_id": "example_agent",
    "model_id": "demo_model_v1",
    "agent_id": "agent_001",
    "session_id": "session_integrated_weak_evidence"
  },
  "scientific_context": {
    "domain": "materials",
    "project_id": "integrated_demo_project",
    "deployment_profile": "P2_analysis_assistant",
    "domain_overlay": "generic_lab_v0.2"
  },
  "ai_output": {
    "summary": "The agent recommended prioritizing condition B based on a preliminary signal.",
    "raw_ref": "sha256:e5c5eae2316d537ce8ece10ab5556bd81482b509b6cd848c8eded63f601bd520",
    "output_type": "natural_language_recommendation"
  },
  "requested_transition": {
    "requested_action": "prioritize_next_run",
    "requested_tool": "lab_scheduler.prioritize"
  },
  "classification": {
    "scientific_action_type": "A7_resource_or_queue_prioritization",
    "responsibility_level": "R6_resource_allocation",
    "evidence_state": "E2_preliminary_signal",
    "validation_status": "V3_preliminary_experimental_support",
    "verification_status": "Q0_unchecked",
    "classifier_confidence": 0.98,
    "classification_detail": {
      "primary_action_type": "A7_resource_or_queue_prioritization",
      "alternate_action_types": [],
      "matched_source": "tool_registry",
      "matched_evidence": "tool=lab_scheduler.prioritize",
      "uncertainty_flags": [],
      "classifier_mode": "deterministic"
    }
  },
  "decision": {
    "admissibility": "blocked",
    "decision_reason": "Profile P2_analysis_assistant matrix decision for A7_resource_or_queue_prioritization is blocked. Evidence rule E2_preliminary_signal+A7_resource_or_queue_prioritization constrains to blocked (resolved from blocked).",
    "blocked_tools": [
      "freezer.release_slot",
      "freezer.reserve_slot",
      "freezer_inventory.release",
      "freezer_inventory.reserve",
      "inventory.reserve_reagent",
      "lab_scheduler.defer",
      "lab_scheduler.prioritize",
      "reagent_inventory.allocate",
      "robot_queue.submit",
      "sample_tracker.transfer"
    ],
    "allowed_tools": [],
    "required_review_role": null,
    "next_admissible_steps": [
      "downgrade to hypothesis discussion",
      "draft a validation experiment",
      "request domain review before prioritization",
      "gather additional evidence"
    ],
    "consequentiality": true,
    "consequentiality_reason": "mutating tool; external effect; action type A7_resource_or_queue_prioritization; resource allocation; next-run or prioritization language"
  },
  "provenance": {
    "policy_version": "akta-core-v0.5",
    "policy_hash": "sha256:b2878971b3236b33c5011d6e12ed37ed85582f16996b9d538b584733d9f65464",
    "domain_overlay_version": "generic_lab_v0.2",
    "domain_overlay_hash": "sha256:9043be6ab410404da7d6b98e28db21395884745b29372310d24310714f8fe117",
    "tool_registry_hash": "sha256:cba4cdc66bd1574063c1915be40e9d4ec89e075f72d045d2ea44a5478bf8f5be",
    "integrity_mode": "deployment_hmac_attested"
  },
  "integrations": {
    "vsa_report_ref": "VSA-REPORT-INTEGRATED-001",
    "pf_core_obligation_ref": null,
    "pcs_artifact_ref": null,
    "prior_akta_records": []
  },
  "record_hash": "sha256:930669ec791e85bc8913f029a56b9736cfd36a05d9d203a7bdff508cec0bfc6c"
}